{
  "specversion": "1.0",
  "id": "830a25fb2801aefcad81b5a02d54af53c5e706c0ca55086c41983e7c94749e7e",
  "source": "caldav://calendar.example.com/dav/calendars/64f1c0a2e9b1d3f4a5b6c7d8/64f1c0a2e9b1d3f4a5b6c7d8/",
  "type": "fr.linagora.twalk.calendar.event.changed.v1",
  "time": "2026-10-02T14:31:05Z",
  "subject": "mailto:michel@example.com",
  "datacontenttype": "application/json",
  "dataschema": "https://schemas.twalk.dev/cloudevents/v1/calendar.event.changed.schema.json",
  "connection": "agenda-linagora",
  "data": {
    "event": {
      "uid": "8f3a2b1c-4d5e-6f70-8192-a3b4c5d6e7f8",
      "title": "Weekly sync",
      "start": "2026-10-05T10:00:00+02:00",
      "end": "2026-10-05T10:30:00+02:00",
      "all_day": false,
      "timezone": "Europe/Paris",
      "status": "confirmed",
      "recurrence": "FREQ=WEEKLY;BYDAY=MO",
      "organizer": {
        "identity": "mailto:michel@example.com",
        "name": "Michel Maudet"
      },
      "participants": [
        {
          "identity": "mailto:michel@example.com",
          "name": "Michel Maudet",
          "role": "chair",
          "partstat": "accepted"
        },
        {
          "identity": "mailto:alice@example.org",
          "name": "Alice Martin",
          "role": "required",
          "partstat": "accepted"
        },
        {
          "identity": "mailto:bob@example.org",
          "name": null,
          "role": "optional",
          "partstat": "needs-action"
        }
      ],
      "participants_withheld": 0
    },
    "changed_fields": [
      "start",
      "end"
    ]
  }
}
